


        --------------------------
     |- SOLIDZ OUTPUT FOR PROBLEM: exacsoLineal
        --------------------------




          FINITE ELEMENT ERRORS
          =====================

          TIME STEP NO.    0,  ITERATION NO.     0
          -----------------------
          NORM    DISPLACEMENT               
          -----------------------
          W(0,1)  8.10000000E-001
          W(0,2)  8.49972318E-001
          W(0,i)  8.97560976E-001
          W(1,1)  2.52000000E+000
          W(1,2)  4.71168760E+000
          W(1,i)  1.57500000E+001
          -----------------------



          FINITE ELEMENT ERRORS
          =====================

          TIME STEP NO.    1,  ITERATION NO.     5
          -----------------------
          NORM    DISPLACEMENT               
          -----------------------
          W(0,1)  1.32978116E-001
          W(0,2)  1.46437826E-001
          W(0,i)  1.48745753E-001
          W(1,1)  4.01507173E-001
          W(1,2)  5.24087997E-001
          W(1,i)  1.33733411E+000
          -----------------------



          FINITE ELEMENT ERRORS
          =====================

          TIME STEP NO.    2,  ITERATION NO.     5
          -----------------------
          NORM    DISPLACEMENT               
          -----------------------
          W(0,1)  9.83090841E-002
          W(0,2)  1.07100350E-001
          W(0,i)  1.06797396E-001
          W(1,1)  2.91675656E-001
          W(1,2)  3.98655576E-001
          W(1,i)  1.12049645E+000
          -----------------------



          FINITE ELEMENT ERRORS
          =====================

          TIME STEP NO.    3,  ITERATION NO.     5
          -----------------------
          NORM    DISPLACEMENT               
          -----------------------
          W(0,1)  9.17333094E-002
          W(0,2)  1.02914819E-001
          W(0,i)  1.08972881E-001
          W(1,1)  2.88999663E-001
          W(1,2)  3.59879272E-001
          W(1,i)  7.92739442E-001
          -----------------------



          FINITE ELEMENT ERRORS
          =====================

          TIME STEP NO.    4,  ITERATION NO.     5
          -----------------------
          NORM    DISPLACEMENT               
          -----------------------
          W(0,1)  2.43719558E-002
          W(0,2)  2.68285887E-002
          W(0,i)  2.89891897E-002
          W(1,1)  7.88274675E-002
          W(1,2)  1.16874395E-001
          W(1,i)  3.70496403E-001
          -----------------------



          FINITE ELEMENT ERRORS
          =====================

          TIME STEP NO.    5,  ITERATION NO.     4
          -----------------------
          NORM    DISPLACEMENT               
          -----------------------
          W(0,1)  5.20028476E-002
          W(0,2)  5.88850865E-002
          W(0,i)  6.35806427E-002
          W(1,1)  1.67147447E-001
          W(1,2)  2.05234686E-001
          W(1,i)  4.21168151E-001
          -----------------------



          FINITE ELEMENT ERRORS
          =====================

          TIME STEP NO.    6,  ITERATION NO.     4
          -----------------------
          NORM    DISPLACEMENT               
          -----------------------
          W(0,1)  6.40540049E-003
          W(0,2)  7.42293532E-003
          W(0,i)  9.95281312E-003
          W(1,1)  3.83113377E-002
          W(1,2)  4.55873009E-002
          W(1,i)  9.03233315E-002
          -----------------------



          FINITE ELEMENT ERRORS
          =====================

          TIME STEP NO.    7,  ITERATION NO.     4
          -----------------------
          NORM    DISPLACEMENT               
          -----------------------
          W(0,1)  2.51462186E-002
          W(0,2)  2.86274364E-002
          W(0,i)  3.12338478E-002
          W(1,1)  8.14122457E-002
          W(1,2)  9.97731133E-002
          W(1,i)  2.00569831E-001
          -----------------------



          FINITE ELEMENT ERRORS
          =====================

          TIME STEP NO.    8,  ITERATION NO.     4
          -----------------------
          NORM    DISPLACEMENT               
          -----------------------
          W(0,1)  8.68138462E-003
          W(0,2)  1.07778056E-002
          W(0,i)  1.37779163E-002
          W(1,1)  3.59136159E-002
          W(1,2)  4.27905461E-002
          W(1,i)  8.13030047E-002
          -----------------------



          FINITE ELEMENT ERRORS
          =====================

          TIME STEP NO.    9,  ITERATION NO.     4
          -----------------------
          NORM    DISPLACEMENT               
          -----------------------
          W(0,1)  1.01538121E-002
          W(0,2)  1.16116572E-002
          W(0,i)  1.27639952E-002
          W(1,1)  3.28240351E-002
          W(1,2)  4.05439236E-002
          W(1,i)  8.38346880E-002
          -----------------------



          FINITE ELEMENT ERRORS
          =====================

          TIME STEP NO.   10,  ITERATION NO.     4
          -----------------------
          NORM    DISPLACEMENT               
          -----------------------
          W(0,1)  7.22885327E-003
          W(0,2)  8.67997268E-003
          W(0,i)  1.05794730E-002
          W(1,1)  2.73436542E-002
          W(1,2)  3.21711145E-002
          W(1,i)  5.56118104E-002
          -----------------------



          FINITE ELEMENT ERRORS
          =====================

          TIME STEP NO.   11,  ITERATION NO.     4
          -----------------------
          NORM    DISPLACEMENT               
          -----------------------
          W(0,1)  3.02323741E-003
          W(0,2)  3.49801877E-003
          W(0,i)  3.90525497E-003
          W(1,1)  9.73150784E-003
          W(1,2)  1.24184557E-002
          W(1,i)  2.90361169E-002
          -----------------------



          FINITE ELEMENT ERRORS
          =====================

          TIME STEP NO.   12,  ITERATION NO.     4
          -----------------------
          NORM    DISPLACEMENT               
          -----------------------
          W(0,1)  4.52595101E-003
          W(0,2)  5.37787859E-003
          W(0,i)  6.45814565E-003
          W(1,1)  1.66313211E-002
          W(1,2)  1.95483372E-002
          W(1,i)  3.22767183E-002
          -----------------------



          FINITE ELEMENT ERRORS
          =====================

          TIME STEP NO.   13,  ITERATION NO.     4
          -----------------------
          NORM    DISPLACEMENT               
          -----------------------
          W(0,1)  3.54156894E-004
          W(0,2)  4.42396007E-004
          W(0,i)  6.59747226E-004
          W(1,1)  1.89379999E-003
          W(1,2)  2.43243297E-003
          W(1,i)  7.07010720E-003
          -----------------------



          FINITE ELEMENT ERRORS
          =====================

          TIME STEP NO.   14,  ITERATION NO.     4
          -----------------------
          NORM    DISPLACEMENT               
          -----------------------
          W(0,1)  2.35879114E-003
          W(0,2)  2.79773774E-003
          W(0,i)  3.35076178E-003
          W(1,1)  8.56939000E-003
          W(1,2)  1.00955630E-002
          W(1,i)  1.66026062E-002
          -----------------------



          FINITE ELEMENT ERRORS
          =====================

          TIME STEP NO.   15,  ITERATION NO.     4
          -----------------------
          NORM    DISPLACEMENT               
          -----------------------
          W(0,1)  5.93054075E-004
          W(0,2)  7.11759719E-004
          W(0,i)  8.57257689E-004
          W(1,1)  2.38064847E-003
          W(1,2)  2.80704335E-003
          W(1,i)  4.99743227E-003
          -----------------------



          FINITE ELEMENT ERRORS
          =====================

          TIME STEP NO.   16,  ITERATION NO.     4
          -----------------------
          NORM    DISPLACEMENT               
          -----------------------
          W(0,1)  1.03253063E-003
          W(0,2)  1.23035467E-003
          W(0,i)  1.48426869E-003
          W(1,1)  3.74545626E-003
          W(1,2)  4.43060727E-003
          W(1,i)  7.35136397E-003
          -----------------------



          FINITE ELEMENT ERRORS
          =====================

          TIME STEP NO.   17,  ITERATION NO.     4
          -----------------------
          NORM    DISPLACEMENT               
          -----------------------
          W(0,1)  6.01685030E-004
          W(0,2)  7.04475908E-004
          W(0,i)  8.29601984E-004
          W(1,1)  2.21928774E-003
          W(1,2)  2.58888225E-003
          W(1,i)  4.34519266E-003
          -----------------------



          FINITE ELEMENT ERRORS
          =====================

          TIME STEP NO.   18,  ITERATION NO.     4
          -----------------------
          NORM    DISPLACEMENT               
          -----------------------
          W(0,1)  3.54173631E-004
          W(0,2)  4.29123742E-004
          W(0,i)  5.30265017E-004
          W(1,1)  1.30072067E-003
          W(1,2)  1.55056404E-003
          W(1,i)  2.63672709E-003
          -----------------------



          FINITE ELEMENT ERRORS
          =====================

          TIME STEP NO.   19,  ITERATION NO.     4
          -----------------------
          NORM    DISPLACEMENT               
          -----------------------
          W(0,1)  4.10260082E-004
          W(0,2)  4.79163295E-004
          W(0,i)  5.61021347E-004
          W(1,1)  1.48278199E-003
          W(1,2)  1.73334456E-003
          W(1,i)  2.88560817E-003
          -----------------------



          FINITE ELEMENT ERRORS
          =====================

          TIME STEP NO.   20,  ITERATION NO.     4
          -----------------------
          NORM    DISPLACEMENT               
          -----------------------
          W(0,1)  6.53847094E-005
          W(0,2)  8.57598441E-005
          W(0,i)  1.15414111E-004
          W(1,1)  2.58505105E-004
          W(1,2)  3.19663529E-004
          W(1,i)  6.14449770E-004
          -----------------------



          FINITE ELEMENT ERRORS
          =====================

          TIME STEP NO.   21,  ITERATION NO.     4
          -----------------------
          NORM    DISPLACEMENT               
          -----------------------
          W(0,1)  2.28076547E-004
          W(0,2)  2.67105428E-004
          W(0,i)  3.13777995E-004
          W(1,1)  8.18704448E-004
          W(1,2)  9.60962375E-004
          W(1,i)  1.59775098E-003
          -----------------------



          FINITE ELEMENT ERRORS
          =====================

          TIME STEP NO.   22,  ITERATION NO.     3
          -----------------------
          NORM    DISPLACEMENT               
          -----------------------
          W(0,1)  3.49690556E-005
          W(0,2)  3.72761468E-005
          W(0,i)  3.32063944E-005
          W(1,1)  1.13094686E-004
          W(1,2)  1.31198518E-004
          W(1,i)  2.14930653E-004
          -----------------------



          FINITE ELEMENT ERRORS
          =====================

          TIME STEP NO.   23,  ITERATION NO.     3
          -----------------------
          NORM    DISPLACEMENT               
          -----------------------
          W(0,1)  1.07129149E-004
          W(0,2)  1.26346398E-004
          W(0,i)  1.49962000E-004
          W(1,1)  3.84761771E-004
          W(1,2)  4.53944178E-004
          W(1,i)  7.58614716E-004
          -----------------------



          FINITE ELEMENT ERRORS
          =====================

          TIME STEP NO.   24,  ITERATION NO.     3
          -----------------------
          NORM    DISPLACEMENT               
          -----------------------
          W(0,1)  4.84178956E-005
          W(0,2)  5.38433702E-005
          W(0,i)  5.64834701E-005
          W(1,1)  1.63027957E-004
          W(1,2)  1.89206867E-004
          W(1,i)  2.94219381E-004
          -----------------------



          FINITE ELEMENT ERRORS
          =====================

          TIME STEP NO.   25,  ITERATION NO.     3
          -----------------------
          NORM    DISPLACEMENT               
          -----------------------
          W(0,1)  4.11650517E-005
          W(0,2)  4.93020563E-005
          W(0,i)  5.98013512E-005
          W(1,1)  1.49422820E-004
          W(1,2)  1.77575841E-004
          W(1,i)  3.00972235E-004
          -----------------------



          FINITE ELEMENT ERRORS
          =====================

          TIME STEP NO.   26,  ITERATION NO.     3
          -----------------------
          NORM    DISPLACEMENT               
          -----------------------
          W(0,1)  3.64597731E-005
          W(0,2)  4.12683630E-005
          W(0,i)  4.52094699E-005
          W(1,1)  1.24412342E-004
          W(1,2)  1.45381588E-004
          W(1,i)  2.29123423E-004
          -----------------------



          FINITE ELEMENT ERRORS
          =====================

          TIME STEP NO.   27,  ITERATION NO.     3
          -----------------------
          NORM    DISPLACEMENT               
          -----------------------
          W(0,1)  1.08857258E-005
          W(0,2)  1.36294635E-005
          W(0,i)  1.74487631E-005
          W(1,1)  4.11087482E-005
          W(1,2)  4.97854654E-005
          W(1,i)  8.72429789E-005
          -----------------------



          FINITE ELEMENT ERRORS
          =====================

          TIME STEP NO.   28,  ITERATION NO.     3
          -----------------------
          NORM    DISPLACEMENT               
          -----------------------
          W(0,1)  2.16531630E-005
          W(0,2)  2.47762050E-005
          W(0,i)  2.77333229E-005
          W(1,1)  7.43685575E-005
          W(1,2)  8.73760145E-005
          W(1,i)  1.38940725E-004
          -----------------------



          FINITE ELEMENT ERRORS
          =====================

          TIME STEP NO.   29,  ITERATION NO.     3
          -----------------------
          NORM    DISPLACEMENT               
          -----------------------
          W(0,1)  1.42772113E-006
          W(0,2)  1.78926660E-006
          W(0,i)  2.26230992E-006
          W(1,1)  5.52940959E-006
          W(1,2)  6.98104665E-006
          W(1,i)  1.70372856E-005
          -----------------------



          FINITE ELEMENT ERRORS
          =====================

          TIME STEP NO.   30,  ITERATION NO.     3
          -----------------------
          NORM    DISPLACEMENT               
          -----------------------
          W(0,1)  1.08465787E-005
          W(0,2)  1.25413882E-005
          W(0,i)  1.42897258E-005
          W(1,1)  3.74602817E-005
          W(1,2)  4.42478036E-005
          W(1,i)  7.10307304E-005
          -----------------------



          FINITE ELEMENT ERRORS
          =====================

          TIME STEP NO.   31,  ITERATION NO.     3
          -----------------------
          NORM    DISPLACEMENT               
          -----------------------
          W(0,1)  3.51847887E-006
          W(0,2)  3.82145443E-006
          W(0,i)  3.58668898E-006
          W(1,1)  1.15990000E-005
          W(1,2)  1.33613222E-005
          W(1,i)  2.00587186E-005
          -----------------------



          FINITE ELEMENT ERRORS
          =====================

          TIME STEP NO.   32,  ITERATION NO.     3
          -----------------------
          NORM    DISPLACEMENT               
          -----------------------
          W(0,1)  4.55090263E-006
          W(0,2)  5.34214261E-006
          W(0,i)  6.21649295E-006
          W(1,1)  1.58113642E-005
          W(1,2)  1.88483488E-005
          W(1,i)  3.06491387E-005
          -----------------------



          FINITE ELEMENT ERRORS
          =====================

          TIME STEP NO.   33,  ITERATION NO.     3
          -----------------------
          NORM    DISPLACEMENT               
          -----------------------
          W(0,1)  3.08323789E-006
          W(0,2)  3.43313116E-006
          W(0,i)  3.59345844E-006
          W(1,1)  1.03776718E-005
          W(1,2)  1.20514284E-005
          W(1,i)  1.85838799E-005
          -----------------------



          FINITE ELEMENT ERRORS
          =====================

          TIME STEP NO.   34,  ITERATION NO.     3
          -----------------------
          NORM    DISPLACEMENT               
          -----------------------
          W(0,1)  1.45447227E-006
          W(0,2)  1.76798163E-006
          W(0,i)  2.12923940E-006
          W(1,1)  5.11328812E-006
          W(1,2)  6.23454826E-006
          W(1,i)  1.04128546E-005
          -----------------------



          FINITE ELEMENT ERRORS
          =====================

          TIME STEP NO.   35,  ITERATION NO.     3
          -----------------------
          NORM    DISPLACEMENT               
          -----------------------
          W(0,1)  1.98229692E-006
          W(0,2)  2.23893139E-006
          W(0,i)  2.43436559E-006
          W(1,1)  6.73555948E-006
          W(1,2)  7.87329439E-006
          W(1,i)  1.23881810E-005
          -----------------------



          FINITE ELEMENT ERRORS
          =====================

          TIME STEP NO.   36,  ITERATION NO.     3
          -----------------------
          NORM    DISPLACEMENT               
          -----------------------
          W(0,1)  2.45695071E-007
          W(0,2)  3.13394624E-007
          W(0,i)  3.87368198E-007
          W(1,1)  8.69748730E-007
          W(1,2)  1.10229427E-006
          W(1,i)  1.92616639E-006
          -----------------------



          FINITE ELEMENT ERRORS
          =====================

          TIME STEP NO.   37,  ITERATION NO.     3
          -----------------------
          NORM    DISPLACEMENT               
          -----------------------
          W(0,1)  1.05962591E-006
          W(0,2)  1.21105830E-006
          W(0,i)  1.34951284E-006
          W(1,1)  3.62075910E-006
          W(1,2)  4.26130156E-006
          W(1,i)  6.80506816E-006
          -----------------------



          FINITE ELEMENT ERRORS
          =====================

          TIME STEP NO.   38,  ITERATION NO.     3
          -----------------------
          NORM    DISPLACEMENT               
          -----------------------
          W(0,1)  2.16551371E-007
          W(0,2)  2.39474057E-007
          W(0,i)  2.39403794E-007
          W(1,1)  7.39834799E-007
          W(1,2)  8.48571799E-007
          W(1,i)  1.27092599E-006
          -----------------------



          FINITE ELEMENT ERRORS
          =====================

          TIME STEP NO.   39,  ITERATION NO.     3
          -----------------------
          NORM    DISPLACEMENT               
          -----------------------
          W(0,1)  4.79335685E-007
          W(0,2)  5.55819209E-007
          W(0,i)  6.34009068E-007
          W(1,1)  1.64695851E-006
          W(1,2)  1.95532796E-006
          W(1,i)  3.17323188E-006
          -----------------------



          FINITE ELEMENT ERRORS
          =====================

          TIME STEP NO.   40,  ITERATION NO.     3
          -----------------------
          NORM    DISPLACEMENT               
          -----------------------
          W(0,1)  2.46292258E-007
          W(0,2)  2.72815413E-007
          W(0,i)  2.76334129E-007
          W(1,1)  8.41098982E-007
          W(1,2)  9.65136723E-007
          W(1,i)  1.41960841E-006
          -----------------------



          FINITE ELEMENT ERRORS
          =====================

          TIME STEP NO.   41,  ITERATION NO.     3
          -----------------------
          NORM    DISPLACEMENT               
          -----------------------
          W(0,1)  1.74608586E-007
          W(0,2)  2.08023324E-007
          W(0,i)  2.44670250E-007
          W(1,1)  6.03806181E-007
          W(1,2)  7.30808195E-007
          W(1,i)  1.21333069E-006
          -----------------------



          FINITE ELEMENT ERRORS
          =====================

          TIME STEP NO.   42,  ITERATION NO.     3
          -----------------------
          NORM    DISPLACEMENT               
          -----------------------
          W(0,1)  1.75009554E-007
          W(0,2)  1.96518669E-007
          W(0,i)  2.10277530E-007
          W(1,1)  6.00126408E-007
          W(1,2)  6.94803482E-007
          W(1,i)  1.06501325E-006
          -----------------------



          FINITE ELEMENT ERRORS
          =====================

          TIME STEP NO.   43,  ITERATION NO.     3
          -----------------------
          NORM    DISPLACEMENT               
          -----------------------
          W(0,1)  4.02359560E-008
          W(0,2)  5.28562039E-008
          W(0,i)  6.51567937E-008
          W(1,1)  1.42822750E-007
          W(1,2)  1.84747553E-007
          W(1,i)  3.24685327E-007
          -----------------------



          FINITE ELEMENT ERRORS
          =====================

          TIME STEP NO.   44,  ITERATION NO.     3
          -----------------------
          NORM    DISPLACEMENT               
          -----------------------
          W(0,1)  1.00221860E-007
          W(0,2)  1.13867655E-007
          W(0,i)  1.25605247E-007
          W(1,1)  3.44810411E-007
          W(1,2)  4.02417674E-007
          W(1,i)  6.30927437E-007
          -----------------------



          FINITE ELEMENT ERRORS
          =====================

          TIME STEP NO.   45,  ITERATION NO.     3
          -----------------------
          NORM    DISPLACEMENT               
          -----------------------
          W(0,1)  1.01600108E-008
          W(0,2)  1.33205339E-008
          W(0,i)  1.70101598E-008
          W(1,1)  3.78732792E-008
          W(1,2)  4.75524422E-008
          W(1,i)  8.31740296E-008
          -----------------------



          FINITE ELEMENT ERRORS
          =====================

          TIME STEP NO.   46,  ITERATION NO.     3
          -----------------------
          NORM    DISPLACEMENT               
          -----------------------
          W(0,1)  4.85487836E-008
          W(0,2)  5.59126110E-008
          W(0,i)  6.33283253E-008
          W(1,1)  1.67783693E-007
          W(1,2)  1.97507629E-007
          W(1,i)  3.15750386E-007
          -----------------------



          FINITE ELEMENT ERRORS
          =====================

          TIME STEP NO.   47,  ITERATION NO.     3
          -----------------------
          NORM    DISPLACEMENT               
          -----------------------
          W(0,1)  1.85202490E-008
          W(0,2)  2.04391785E-008
          W(0,i)  1.90844676E-008
          W(1,1)  6.37623515E-008
          W(1,2)  7.26787235E-008
          W(1,i)  9.98715245E-008
          -----------------------



          FINITE ELEMENT ERRORS
          =====================

          TIME STEP NO.   48,  ITERATION NO.     3
          -----------------------
          NORM    DISPLACEMENT               
          -----------------------
          W(0,1)  1.95120351E-008
          W(0,2)  2.29771305E-008
          W(0,i)  2.68627916E-008
          W(1,1)  6.79189463E-008
          W(1,2)  8.11031230E-008
          W(1,i)  1.32663446E-007
          -----------------------



          FINITE ELEMENT ERRORS
          =====================

          TIME STEP NO.   49,  ITERATION NO.     3
          -----------------------
          NORM    DISPLACEMENT               
          -----------------------
          W(0,1)  1.49917993E-008
          W(0,2)  1.67075593E-008
          W(0,i)  1.72890436E-008
          W(1,1)  5.15682716E-008
          W(1,2)  5.92541161E-008
          W(1,i)  8.82189459E-008
          -----------------------



          FINITE ELEMENT ERRORS
          =====================

          TIME STEP NO.   50,  ITERATION NO.     2
          -----------------------
          NORM    DISPLACEMENT               
          -----------------------
          W(0,1)  5.73277065E-009
          W(0,2)  7.16531510E-009
          W(0,i)  8.79639040E-009
          W(1,1)  2.03386852E-008
          W(1,2)  2.52420821E-008
          W(1,i)  4.28501908E-008
          -----------------------



          FINITE ELEMENT ERRORS
          =====================

          TIME STEP NO.   51,  ITERATION NO.     3
          -----------------------
          NORM    DISPLACEMENT               
          -----------------------
          W(0,1)  9.25505368E-009
          W(0,2)  1.04336981E-008
          W(0,i)  1.12720869E-008
          W(1,1)  3.19049519E-008
          W(1,2)  3.69617913E-008
          W(1,i)  5.68673934E-008
          -----------------------



          FINITE ELEMENT ERRORS
          =====================

          TIME STEP NO.   52,  ITERATION NO.     2
          -----------------------
          NORM    DISPLACEMENT               
          -----------------------
          W(0,1)  1.16599368E-009
          W(0,2)  1.27873944E-009
          W(0,i)  1.29703159E-009
          W(1,1)  3.89717972E-009
          W(1,2)  4.46975721E-009
          W(1,i)  6.85861348E-009
          -----------------------



          FINITE ELEMENT ERRORS
          =====================

          TIME STEP NO.   53,  ITERATION NO.     2
          -----------------------
          NORM    DISPLACEMENT               
          -----------------------
          W(0,1)  4.78620583E-009
          W(0,2)  5.46531187E-009
          W(0,i)  6.09431284E-009
          W(1,1)  1.65556849E-008
          W(1,2)  1.93479427E-008
          W(1,i)  3.04756956E-008
          -----------------------



          FINITE ELEMENT ERRORS
          =====================

          TIME STEP NO.   54,  ITERATION NO.     2
          -----------------------
          NORM    DISPLACEMENT               
          -----------------------
          W(0,1)  1.27014264E-009
          W(0,2)  1.41345274E-009
          W(0,i)  1.45396386E-009
          W(1,1)  4.36156205E-009
          W(1,2)  5.00933682E-009
          W(1,i)  7.45684205E-009
          -----------------------



          FINITE ELEMENT ERRORS
          =====================

          TIME STEP NO.   55,  ITERATION NO.     2
          -----------------------
          NORM    DISPLACEMENT               
          -----------------------
          W(0,1)  2.08508086E-009
          W(0,2)  2.42632338E-009
          W(0,i)  2.79695728E-009
          W(1,1)  7.26358336E-009
          W(1,2)  8.58453694E-009
          W(1,i)  1.38474655E-008
          -----------------------



          FINITE ELEMENT ERRORS
          =====================

          TIME STEP NO.   56,  ITERATION NO.     2
          -----------------------
          NORM    DISPLACEMENT               
          -----------------------
          W(0,1)  1.24111206E-009
          W(0,2)  1.36847823E-009
          W(0,i)  1.32886152E-009
          W(1,1)  4.24139460E-009
          W(1,2)  4.84652204E-009
          W(1,i)  6.88585324E-009
          -----------------------



          FINITE ELEMENT ERRORS
          =====================

          TIME STEP NO.   57,  ITERATION NO.     2
          -----------------------
          NORM    DISPLACEMENT               
          -----------------------
          W(0,1)  7.14308118E-010
          W(0,2)  8.66206718E-010
          W(0,i)  1.04557845E-009
          W(1,1)  2.52233842E-009
          W(1,2)  3.06199335E-009
          W(1,i)  5.09173256E-009
          -----------------------



          FINITE ELEMENT ERRORS
          =====================

          TIME STEP NO.   58,  ITERATION NO.     2
          -----------------------
          NORM    DISPLACEMENT               
          -----------------------
          W(0,1)  8.35090817E-010
          W(0,2)  9.31248845E-010
          W(0,i)  9.70208336E-010
          W(1,1)  2.86288489E-009
          W(1,2)  3.29613871E-009
          W(1,i)  4.94247208E-009
          -----------------------



          FINITE ELEMENT ERRORS
          =====================

          TIME STEP NO.   59,  ITERATION NO.     2
          -----------------------
          NORM    DISPLACEMENT               
          -----------------------
          W(0,1)  1.53104811E-010
          W(0,2)  2.03118883E-010
          W(0,i)  2.56857861E-010
          W(1,1)  5.55323338E-010
          W(1,2)  7.15160652E-010
          W(1,i)  1.24966674E-009
          -----------------------



          FINITE ELEMENT ERRORS
          =====================

          TIME STEP NO.   60,  ITERATION NO.     2
          -----------------------
          NORM    DISPLACEMENT               
          -----------------------
          W(0,1)  4.61041072E-010
          W(0,2)  5.20590150E-010
          W(0,i)  5.65311660E-010
          W(1,1)  1.58592850E-009
          W(1,2)  1.84181109E-009
          W(1,i)  2.84917990E-009
          -----------------------



          FINITE ELEMENT ERRORS
          =====================

          TIME STEP NO.   61,  ITERATION NO.     2
          -----------------------
          NORM    DISPLACEMENT               
          -----------------------
          W(0,1)  7.25581175E-011
          W(0,2)  8.94658108E-011
          W(0,i)  1.08931736E-010
          W(1,1)  2.55536187E-010
          W(1,2)  3.14977299E-010
          W(1,i)  5.34094863E-010
          -----------------------



          FINITE ELEMENT ERRORS
          =====================

          TIME STEP NO.   62,  ITERATION NO.     2
          -----------------------
          NORM    DISPLACEMENT               
          -----------------------
          W(0,1)  2.15530816E-010
          W(0,2)  2.47431085E-010
          W(0,i)  2.78746713E-010
          W(1,1)  7.45666997E-010
          W(1,2)  8.74990201E-010
          W(1,i)  1.39066913E-009
          -----------------------



          FINITE ELEMENT ERRORS
          =====================

          TIME STEP NO.   63,  ITERATION NO.     2
          -----------------------
          NORM    DISPLACEMENT               
          -----------------------
          W(0,1)  9.76125215E-011
          W(0,2)  1.07051492E-010
          W(0,i)  9.77871160E-011
          W(1,1)  3.32151967E-010
          W(1,2)  3.78482936E-010
          W(1,i)  5.15409486E-010
          -----------------------



          FINITE ELEMENT ERRORS
          =====================

          TIME STEP NO.   64,  ITERATION NO.     2
          -----------------------
          NORM    DISPLACEMENT               
          -----------------------
          W(0,1)  8.25162948E-011
          W(0,2)  9.76542101E-011
          W(0,i)  1.14977340E-010
          W(1,1)  2.88505251E-010
          W(1,2)  3.45074205E-010
          W(1,i)  5.65974812E-010
          -----------------------



          FINITE ELEMENT ERRORS
          =====================

          TIME STEP NO.   65,  ITERATION NO.     2
          -----------------------
          NORM    DISPLACEMENT               
          -----------------------
          W(0,1)  7.31793841E-011
          W(0,2)  8.08122867E-011
          W(0,i)  8.02295857E-011
          W(1,1)  2.49566060E-010
          W(1,2)  2.85781853E-010
          W(1,i)  4.13444913E-010
          -----------------------



          FINITE ELEMENT ERRORS
          =====================

          TIME STEP NO.   66,  ITERATION NO.     2
          -----------------------
          NORM    DISPLACEMENT               
          -----------------------
          W(0,1)  2.19214534E-011
          W(0,2)  2.84511519E-011
          W(0,i)  3.56608639E-011
          W(1,1)  7.91453704E-011
          W(1,2)  1.00296421E-010
          W(1,i)  1.73762507E-010
          -----------------------



          FINITE ELEMENT ERRORS
          =====================

          TIME STEP NO.   67,  ITERATION NO.     2
          -----------------------
          NORM    DISPLACEMENT               
          -----------------------
          W(0,1)  4.33054647E-011
          W(0,2)  4.83806868E-011
          W(0,i)  5.08575968E-011
          W(1,1)  1.48242720E-010
          W(1,2)  1.71059760E-010
          W(1,i)  2.58332716E-010
          -----------------------



          FINITE ELEMENT ERRORS
          =====================

          TIME STEP NO.   68,  ITERATION NO.     2
          -----------------------
          NORM    DISPLACEMENT               
          -----------------------
          W(0,1)  5.65370365E-012
          W(0,2)  6.41357188E-012
          W(0,i)  7.17092639E-012
          W(1,1)  1.91109426E-011
          W(1,2)  2.24224783E-011
          W(1,i)  3.58436222E-011
          -----------------------



          FINITE ELEMENT ERRORS
          =====================

          TIME STEP NO.   69,  ITERATION NO.     2
          -----------------------
          NORM    DISPLACEMENT               
          -----------------------
          W(0,1)  2.16073770E-011
          W(0,2)  2.44945142E-011
          W(0,i)  2.68751770E-011
          W(1,1)  7.42929569E-011
          W(1,2)  8.65827879E-011
          W(1,i)  1.35048358E-010
          -----------------------



          FINITE ELEMENT ERRORS
          =====================

          TIME STEP NO.   70,  ITERATION NO.     2
          -----------------------
          NORM    DISPLACEMENT               
          -----------------------
          W(0,1)  7.09320275E-012
          W(0,2)  7.89254110E-012
          W(0,i)  8.17042857E-012
          W(1,1)  2.42359804E-011
          W(1,2)  2.79004153E-011
          W(1,i)  4.16801535E-011
          -----------------------



          FINITE ELEMENT ERRORS
          =====================

          TIME STEP NO.   71,  ITERATION NO.     2
          -----------------------
          NORM    DISPLACEMENT               
          -----------------------
          W(0,1)  9.03428591E-012
          W(0,2)  1.04857458E-011
          W(0,i)  1.20228237E-011
          W(1,1)  3.13394686E-011
          W(1,2)  3.70418909E-011
          W(1,i)  5.98846873E-011
          -----------------------



          FINITE ELEMENT ERRORS
          =====================

          TIME STEP NO.   72,  ITERATION NO.     2
          -----------------------
          NORM    DISPLACEMENT               
          -----------------------
          W(0,1)  6.18672791E-012
          W(0,2)  6.79357071E-012
          W(0,i)  6.34123407E-012
          W(1,1)  2.10785142E-011
          W(1,2)  2.40301266E-011
          W(1,i)  3.32499056E-011
          -----------------------



          FINITE ELEMENT ERRORS
          =====================

          TIME STEP NO.   73,  ITERATION NO.     2
          -----------------------
          NORM    DISPLACEMENT               
          -----------------------
          W(0,1)  2.88090439E-012
          W(0,2)  3.54608748E-012
          W(0,i)  4.31954079E-012
          W(1,1)  1.01994816E-011
          W(1,2)  1.25116440E-011
          W(1,i)  2.11886986E-011
          -----------------------



          FINITE ELEMENT ERRORS
          =====================

          TIME STEP NO.   74,  ITERATION NO.     2
          -----------------------
          NORM    DISPLACEMENT               
          -----------------------
          W(0,1)  3.95847617E-012
          W(0,2)  4.38704682E-012
          W(0,i)  4.44075988E-012
          W(1,1)  1.35201189E-011
          W(1,2)  1.55170823E-011
          W(1,i)  2.27532023E-011
          -----------------------



          FINITE ELEMENT ERRORS
          =====================

          TIME STEP NO.   75,  ITERATION NO.     2
          -----------------------
          NORM    DISPLACEMENT               
          -----------------------
          W(0,1)  6.68895481E-013
          W(0,2)  7.92133183E-013
          W(0,i)  9.35084708E-013
          W(1,1)  2.29885243E-012
          W(1,2)  2.77371983E-012
          W(1,i)  4.76005411E-012
          -----------------------



          FINITE ELEMENT ERRORS
          =====================

          TIME STEP NO.   76,  ITERATION NO.     2
          -----------------------
          NORM    DISPLACEMENT               
          -----------------------
          W(0,1)  2.11481871E-012
          W(0,2)  2.37066984E-012
          W(0,i)  2.52346733E-012
          W(1,1)  7.25622782E-012
          W(1,2)  8.38676578E-012
          W(1,i)  1.28628390E-011
          -----------------------



          FINITE ELEMENT ERRORS
          =====================

          TIME STEP NO.   77,  ITERATION NO.     2
          -----------------------
          NORM    DISPLACEMENT               
          -----------------------
          W(0,1)  4.48067814E-013
          W(0,2)  5.34750168E-013
          W(0,i)  6.32512970E-013
          W(1,1)  1.57963337E-012
          W(1,2)  1.89658543E-012
          W(1,i)  3.31484650E-012
          -----------------------



          FINITE ELEMENT ERRORS
          =====================

          TIME STEP NO.   78,  ITERATION NO.     2
          -----------------------
          NORM    DISPLACEMENT               
          -----------------------
          W(0,1)  9.55524056E-013
          W(0,2)  1.09165328E-012
          W(0,i)  1.22369404E-012
          W(1,1)  3.30004782E-012
          W(1,2)  3.86102227E-012
          W(1,i)  6.06895719E-012
          -----------------------

     |- SOLIDZ IS STATIONARY AT TIME STEP    79



          FINITE ELEMENT ERRORS
          =====================

          TIME STEP NO.   79,  ITERATION NO.     2
          -----------------------
          NORM    DISPLACEMENT               
          -----------------------
          W(0,1)  4.98703082E-013
          W(0,2)  5.47048612E-013
          W(0,i)  5.09151918E-013
          W(1,1)  1.70487769E-012
          W(1,2)  1.93990458E-012
          W(1,i)  2.71223338E-012
          -----------------------


        -----------------
     |- SUMMARY OF SOLVER
        -----------------


        DISPLACEMENT:
        -------------

        SOLVER:               CONJUGATE GRADIENT
        # SOLVES=                  233
        PRECONDITIONER:       DIAGONAL diag(A)
        MIN. # ITERATIONS=          22
        MAX. # ITERATIONS=          33
        AVE. # ITERATIONS=          29
        TOT. # ITERATIONS=        6842
        TOT. CPU TIME=         0.110765E+000


        SUMMARY OF SOLVER TIMES:

        TOTAL SOLVER CPU TIME (AVERAGE):  1.100E-01
          Initial operations:             5.895E-03 (  5.36 % )
          Preconditioning:                4.769E-02 ( 43.35 % )
          Coarse system solver (DCG):     0.000E+00 (  0.00 % )
          Orthogonalization (GMRES):      0.000E+00 (  0.00 % )
          Others:                         5.643E-02 ( 51.29 % )


        |- SPMV:                         7308

           Computation:             
              Average CPU time:      8.375E-03 
              Maximum CPU time:      8.469E-03 
              Load balance:          9.889E-01
           Point-to-point comm.:    
              Average CPU time:      4.040E-02 
              Maximum CPU time:      4.511E-02 
              Load balance:          8.955E-01
           Overall:                 
              Average CPU time:      4.877E-02 
              Maximum CPU time:      5.345E-02 
              Load balance:          9.125E-01



     |- END OF SOLIDZ RUN

